{
  "name": "Hobbyist",
  "role": "Recreation · 100 m",
  "mass": 4.2,
  "inertia": [
    0.16,
    0.24,
    0.28
  ],
  "addedMass": [
    2,
    3.1,
    3.6,
    0.04,
    0.08,
    0.09
  ],
  "linearDamping": [
    4,
    6.2,
    7.4,
    0.45,
    0.72,
    0.78
  ],
  "quadraticDamping": [
    6,
    9,
    11,
    0.32,
    0.5,
    0.55
  ],
  "leverScale": 0.58,
  "cg": 0.018,
  "cameraDistance": 4.2,
  "actuatorTau": 0.1,
  "buoyancyRatio": 1.006,
  "thrusters": [
    {
      "id": "H1",
      "label": "Port drive",
      "r": [
        0,
        -0.43,
        0
      ],
      "f": [
        1,
        0,
        0
      ],
      "force": 5,
      "reverseEfficiency": 0.75,
      "deadband": 0.04
    },
    {
      "id": "H2",
      "label": "Starboard drive",
      "r": [
        0,
        0.43,
        0
      ],
      "f": [
        1,
        0,
        0
      ],
      "force": 5,
      "reverseEfficiency": 0.75,
      "deadband": 0.04
    },
    {
      "id": "V1",
      "label": "Center depth",
      "r": [
        0,
        0,
        -0.05
      ],
      "f": [
        0,
        0,
        1
      ],
      "force": 6,
      "reverseEfficiency": 0.75,
      "deadband": 0.04
    }
  ]
}