{
  "name": "Light work",
  "role": "Manipulation + tooling · 3,000 m",
  "mass": 650,
  "inertia": [
    145,
    230,
    260
  ],
  "addedMass": [
    285,
    410,
    475,
    44,
    116,
    128
  ],
  "linearDamping": [
    250,
    360,
    430,
    92,
    146,
    160
  ],
  "quadraticDamping": [
    390,
    530,
    650,
    68,
    112,
    125
  ],
  "leverScale": 2.1,
  "cg": 0.09,
  "cameraDistance": 8.3,
  "actuatorTau": 0.28,
  "buoyancyRatio": 1.006,
  "thrusters": [
    {
      "id": "H1",
      "label": "Front port vector",
      "r": [
        0.46,
        -0.86,
        0
      ],
      "f": [
        0.7071067811865476,
        0.7071067811865476,
        0
      ],
      "force": 420,
      "reverseEfficiency": 0.75,
      "deadband": 0.04
    },
    {
      "id": "H2",
      "label": "Front starboard vector",
      "r": [
        0.46,
        0.86,
        0
      ],
      "f": [
        0.7071067811865476,
        -0.7071067811865476,
        0
      ],
      "force": 420,
      "reverseEfficiency": 0.75,
      "deadband": 0.04
    },
    {
      "id": "H3",
      "label": "Aft port vector",
      "r": [
        -0.46,
        -0.86,
        0
      ],
      "f": [
        0.7071067811865476,
        -0.7071067811865476,
        0
      ],
      "force": 420,
      "reverseEfficiency": 0.75,
      "deadband": 0.04
    },
    {
      "id": "H4",
      "label": "Aft starboard vector",
      "r": [
        -0.46,
        0.86,
        0
      ],
      "f": [
        0.7071067811865476,
        0.7071067811865476,
        0
      ],
      "force": 420,
      "reverseEfficiency": 0.75,
      "deadband": 0.04
    },
    {
      "id": "V1",
      "label": "Port lift",
      "r": [
        0.08,
        -1.3,
        -0.42
      ],
      "f": [
        0,
        0,
        1
      ],
      "force": 470,
      "reverseEfficiency": 0.75,
      "deadband": 0.04
    },
    {
      "id": "V2",
      "label": "Starboard lift",
      "r": [
        0.08,
        1.3,
        -0.42
      ],
      "f": [
        0,
        0,
        1
      ],
      "force": 470,
      "reverseEfficiency": 0.75,
      "deadband": 0.04
    }
  ]
}